{
  "schema_id": "orgsmith/review-findings@1",
  "slug": "ashcombe-advisory",
  "dimension": "narrative_consistency",
  "generator": {"model": "claude-opus-5-5", "effort": "xhigh"},
  "findings": [
    {
      "schema_id": "orgsmith/review-finding@1",
      "id": "rf:narr-1",
      "dimension": "narrative_consistency",
      "severity": "minor",
      "docs": ["d:0093", "d:0094", "d:0095", "d:0021"],
      "summary": "The three working drafts of the Castaneda, Adams and Davis kickoff memo are dated before the engagement began but already describe its start in the past tense, and the v3 copy is the one the client received.",
      "evidence": "d:0093 (created 2018-06-27), d:0094 (2018-07-01) and d:0095 (2018-07-05) each read 'Our engagement with Castaneda, Adams and Davis formally began on July 6, 2018'. The ledger start for E-2018-001 is 2018-07-06, and the final memo d:0020 (2018-07-09) is the only version dated after it. d:0021 (2018-08-03) attaches the v3 file, whose embedded created date is 2018-07-05. The drafts are noise-stage copies of d:0020's DocIR with the trailing blocks dropped and a 'WORKING DRAFT vN' banner added; the copy is backdated without regard to the dated facts in its text, so this is a device-level gap rather than an authoring slip. It is the only version chain in this org whose text carries a date."
    },
    {
      "schema_id": "orgsmith/review-finding@1",
      "id": "rf:narr-2",
      "dimension": "narrative_consistency",
      "severity": "minor",
      "docs": ["d:0007", "d:0032", "d:0059"],
      "summary": "The firm overview reverses its stated policy on naming clients between versions, and no version acknowledges the change.",
      "evidence": "d:0007 (2017): 'We do not publish the names of the companies we advise. A company is entitled to decide for itself whether, and when, to say that it has retained an adviser.' d:0032 (2020) instead says 'We describe a client's work only after the engagement has concluded' and names Barrera Group and Castaneda, Adams and Davis, with no mention of client consent. d:0059 (2023) adds 'only with the agreement of the client concerned' and names four clients, including the 2021 crisis-communications client. Every engagement cited had finished by the overview's date, so the finished-work rule holds; the inconsistency is that the 2017 text, written when no engagement had finished, states a blanket no-names rule that the later versions drop."
    },
    {
      "schema_id": "orgsmith/review-finding@1",
      "id": "rf:narr-3",
      "dimension": "narrative_consistency",
      "severity": "minor",
      "docs": ["d:0084", "d:0078", "d:0079", "d:0080"],
      "summary": "The last message in the Gallegos, Pope and Marsh thread proposes, as if new, a leadership-interview sequence and press conversations that earlier messages in the same thread had already settled or reported under way.",
      "evidence": "d:0084 (Julie Hill, 2024-03-19): 'she will also speak informally with the reporters who cover the company ... We would very much like to speak with your leadership team as well, and ideally before the first investor calls take place.' Quoted beneath it in the same rendered .eml: d:0078 (Julie Hill, 03-11) 'suggest that the investor and analyst calls wait until the leadership interviews are complete'; d:0079 (03-13) 'The leadership interviews go first ... On the press side, I have started background conversations with the reporters you cleared'; d:0080 (Julie Hill, 03-14) 'A brief word on the reporter conversations Michelle mentioned'."
    },
    {
      "schema_id": "orgsmith/review-finding@1",
      "id": "rf:narr-4",
      "dimension": "narrative_consistency",
      "severity": "minor",
      "docs": ["d:0028", "d:0025"],
      "summary": "Two onboarding records are written as if the hire had not yet arrived, although each is dated a week after that person's start date in the roster.",
      "evidence": "d:0028 is dated 2019-02-06, foundation.json gives Sandra Mcdonald's start as 2019-01-30, and the record says 'building access and a firm email account will be ready for her first day'. d:0025 is dated 2019-01-12 against Amy Carter's 2019-01-05 start and says 'The operations team will arrange her building access, laptop, and email account' and 'Her first scheduled step is a working session with Michael Morris early next week'. The other three records sit on the same start-plus-seven-days schedule and read correctly: d:0034 'joined Ashcombe Advisory Partners last week ... Her laptop, firm email account, and remote access are in place', d:0036 'were ready on her first day', d:0060 'are in place'. The authoring brief for onboarding records carries no start date, so each author had to guess."
    }
  ]
}
